;#CODE;ENGLISH;FRENCH;GERMAN;;SPANISH;;;;;;;;;x;
HOLDINGS_DEC_LOSS;占有度: ;Proprits? ;Besitztmer: ;;Posesiones: ;;;;;;;;;x
TOTAL_DEC_DELTA;总体腐化度: ;Contribution totale ?la Dcadence? ;Gesamtbeitrag zur Dekadenz: ;;Contribucin a la Decadencia Total: ;;;;;;;;;x
HAS_A_JOB_DEC;接受一个任务: ;Possde une charge;Hat ein Amt: ;;Tiene un Trabajo: ;;;;;;;;;x
ON_JOB_DEC;正在执行任务中: ;Est en mission? ;fhrt eine Amtsaufgabe aus: ;;Est?en una Misin: ;;;;;;;;;x
CHAR_STATUS_PILGRIM;Y$NAME$? 正在进行朝圣;Y$NAME$? est en plerinage;Y$NAME$? ist auf Pilgerfahrt;;Y$NAME$? est?peregrinando;;;;;;;;;x
EVTDESC1070;当我听说哈菲兹（能背诵全部古兰经的伊斯兰教徒 ）可以准确背诵古兰经里任意一段内容时，我被这个人的虔诚所震惊.铭记古兰经全部的114章内容，是只有最狂热之穆斯林才能做到的壮举！;Tout en coutant le Hafiz rciter sans fautes un verset du Coran, choisi au hasard, je m'merveillais de sa pit: Seuls les musulmans les plus zls sont capables de mmoriser les cent quatorze sourates du Coran.;Als ich dem Hafiz zuhrte, wie er eine zufllige Passage aus dem Qur'an aufsagte, war ich von seiner Piett beeindruckt. Sich den gesamten Qur'an, alle 114 Suren, einzuprgen ist eine Leistung, die nur die frmmsten Muslime vollbringen knnen;;Mientras escuchaba como el Hafiz continuaba recitando correctamente un pasaje al azar del Corn, me maravill?de la piedad de aquel hombre. Conocer el Corn de memoria, sus 114 Suras, es una labor que slo el musulms ms fiel puede realizar.;;;;;;;;;x
EVTOPTA1070;愿真主听我所言，我会记住整部古兰经！;Qu'Allah m'en soit tmoin? j'apprendrai le Coran dans son intgralit!;Bei Allah, ich werde den gesamten Qur'an auswendig lernen!;;Que Al?escuche mis palabras, Voy a memorizarme todo el Corn!;;;;;;;;;x
EVTOPTB1070;太了不起了! 不过这必将是一件苦差事...;Merveilleux? Mais quelle corve...;Fantastisch! Aber das muss eine Heidenarbeit sein...;;Maravilloso! Pero debe ser tan tedioso...;;;;;;;;;x
aspiring_hafiz;雄心勃勃的哈菲兹: 将古兰经铭记于心;Apprenti Hafiz? engag?dans l'apprentissage du Coran;aufstrebender Hafiz: lernt den Qur'an auswendig;;Aspirante a Hafiz: Aprendiendo el Corn de memoria;;;;;;;;;x
EVTDESC1071;面对伊玛目时，我倍感紧张, 等待着他任意挑出古兰经中的一段，然后我必须准确背诵出来.He has chosen:\n\nWhen the 古兰经is read...;Me tenir en face de l'Imam me rend nerveux. J'attends qu'il choisisse et dbute la rcitation d'un verset du Coran choisi au hasard. Je devrais en poursuivre la rcitation sans fautes. Il a choisi? \n\nEt quand on rcite le Coran...;Ich stehe nervs vor dem Imam und warte darauf, dass er eine zufllige Passage aus dem Qur'an auswhlt und beginnt, sie aufzusagen, woraufhin ich sie dann korrekt beenden muss. Er hat sich fr eine entschieden:\n\n Und wenn der Qur'an vorgetragen wird...;;Me muero de los nervios mientras me encuentro ante el Imm, esperando a que escoja y comience a recitar un pasaje aleatorio del Corn que yo debo continuar recitando correctamente. Ya ha hecho su elecion: \nCuando el Corn est?siendo leido...;;;;;;;;;x
EVTOPTA1071;...静下心来，认真聆听，这样你方可得到宽恕;...prtez-lui l'oreille attentivement et observez le silence, afin que vous obteniez la misricorde;...dann hrt ihm zu und horcht hin, auf da?ihr Erbarmen finden mget!;;...escucha con atencin y mantente en paz y as?recibirs la Gracia;;;;;;;;;x
aspiring_faqih;研究伊斯兰律法的学生;Un tudiant du Fiqh, la loi islamique;Ein Gelehrter des Fiqh, des islamischen Rechts;;Estudiante de la Fiqh, la Ley Islmica;;;;;;;;;x
EVTDESC5080;有人问我是否愿意和[Root.Location.GetName]的法基赫一起学习，以便让我以后能够成为伊斯兰世界最伟大的法学家之一..;Un Faqh est un expert du Fiqh, la connaissance des dcisions lgislatives portant sur les actions de l'homme, telles qu'elles dcoulent de l'examen de preuves dtailles. Il m'a t?propos?d'tudier auprs des meilleurs Fuqaha' de [Root.Location.GetName] dans l'espoir de devenir, un jour, l'un des plus grand juriste du monde musulman.;Ein Faqih ist ein Rechtsgelehrter, der auf Basis des Qur'an Recht von Unrecht zu unterscheiden wei? Ich wurde gefragt, ob ich von einigen der besten Faqihs aus [Root.Location.GetName] lernen mchte, um eines Tages vielleicht einer der gr鲞ten Juristen der islamischen Welt zu werden;;Un faqu?es un experto en la 'fiqh' que es el conociemiento de los mandatos de la ley, relativos a las acciones de los hombres, provenientes de sus detalladas evidencias. Me han preguntado si querra estudiar con algunos de los mejores faqus de [Root.Location.GetName] para que algn da pueda convertirme en uno de los ms importantes juristas del mundo Islmico.;;;;;;;;;x
EVTOPTA5080;这是一个我不敢拒绝的机会;C'est une opportunit?que je n'ose refuser.;Dies ist eine Gelegenheit, die ich nicht auszulassen wage;;Una oferta que no he podido rechazar;;;;;;;;;x
EVTOPTB5080;听起来真是一项异常繁重的任务... 不了, 多谢;Cela semble tre beaucoup trop de travail... Non merci;Das klingt nach einer Menge Arbeit... Nein, danke.;;Suena como un trabajo duro...No, gracias;;;;;;;;;x
EVTDESC5081;对于费格赫一年的研究已经离开了我可怜的疲惫之首.费格赫其余的部分也在严酷的要求之内，我将要学习古兰经，圣训，公议以及伊斯兰法来准备我的最终测试，之后我便可以称自己为“法基赫”.;Une anne d'tude du Fiqh a embrouille ma pauvre tte. Les exigences des autres Fuqaha' sont sans piti? Je dois tudier le Coran, la Sunna, l'Idjm (le consensus) et la Qiys (l'analogie) pour me prparer ?l'ultime examen. Aprs cela, je pourrais prtendre tre un Faqh.;Ein Jahr Studium des Fiqh und mir drhnt der Schdel. Die anderen Faqihs sind gnadenlos in ihren Erwartungen. Ich muss nicht nur den Qur'an studieren, sondern auch die Sunna, Idschma (Konsens) und Qiyas (Analogie), um mich auf die Abschlussprfung vorzubereiten. Erst dann darf ich mich selbst einen Faqih nennen.;;Tras un ao estudiando la fiqh ya no s?donde tengo la cabeza. Los otros faqus son inmisericardes en sus exigencias, estoy estudiando el Corn, la Sunna, la Ijma (Consenso) y el Qiyas (Analoga) para prepararme para el ltimo exmen, despus ya ser?un faqu?;;;;;;;;;x
EVTOPTA5081;我不能就此放弃, 离成为一名法基赫只有一步之遥...;Je ne peux pas abandonner maintenant. Je suis si proche de devenir un Faqh...;Ich kann jetzt nicht aufgeben, ich bin so kurz davor, ein Faqih zu werden;;No puedo abandonar, ya queda tan poco para ser un faqu?..;;;;;;;;;x
EVTOPTB5081;我放弃, 这不是我想要的生活...;J'abandonne, ce n'est pas la vie que je souhaite...;Ich gebe auf. Das ist nicht das Leben, das ich mir wnsche;;Abandono, esta no es la vida que deseo...;;;;;;;;;x
EVTDESC5082;我终于成为一个伊斯兰法学专家! 关于古兰经，圣训，公议以及 Qiyas的学习是我成为了一名法基赫，接下来我将要用这些知识使自己成为更优秀的[Root.GetTitle]并更好的统治我的人民.;Je suis enfin devenu un expert en jurisprudence islamique? Ma connaissance du Coran, de la Sunna, de l'Ijm (le consensus) et de la Qiys (l'analogie) font de moi un Faqh. J'emploierais mon savoir pour devenir un meilleur [Root.GetTitle] et guide pour mon peuple.;Ich bin endlich ein Experte des islamischen Rechts! Mein Wissen um den Qur'an, die Sunna, Idschma (Konsens) und Qiyas (Analogie) macht mich zu einem Faqih und ich werde dieses Wissen nutzen, um ein besserer [Root.GetTitle] und Herrscher zu sein.;;Ya soy un experto en jurisprudencia Islmica! Mis conocimientos del Corn, la Sunna, la Ijma (Consenso) y el Qiyas (Analoga) es lo que me hace un faqu?y usar?esos conocimientos para ser un mejor [Root.GetTitle] y gobernante para mi pueblo.;;;;;;;;;x
EVTOPTA5082;我对自己能成为一名法基赫而感到自豪！;Je suis fier d'tre devenu un Faqh?;Ich bin stolz darauf, ein Faqih geworden zu sein!;;Estoy orgulloso de ser un faqu?;;;;;;;;;x
EVTOPTB5082;我要利用的是我的学识而非头衔;J'emploierai le Savoir mais n'en prendrai pas le titre;Ich werde das Wissen verwenden, aber nicht den Titel;;Usar?mis conocimientos pero no el ttulo;;;;;;;;;x
REALM_SIZE_MULTIPLIER_DEC;玩家地图;Multiplicateur de la taille du territoire? ;Multiplikator durch Reichsgr鲞e;;Multiplicador por Tamao del Reino: ;;;;;;;;;x
DEMESNE_FRACTION_DESC;玩家地图: ;Multiplicateur du domaine du chef de la dynastie? ;Domnenmultiplikator fr Dynastie-Oberhaupt;;Multiplicador de la Heredad por Jefe de la Dinasta: ;;;;;;;;;x
DEC_GAIN;收益: ;Gain? ;Anstieg;;Aumento: ;;;;;;;;;x
DEC_GAINREDUCTION;收益下降: ;Rduction? ;Senkung des Anstiegs;;Reduccin del aumento: ;;;;;;;;;x
DEC_MEMBER_CONTR;每月降低的收益: ;Gain mensuel de dcadence? ;Monatlicher Dekadenzanstieg: ;;Aumento de la Decadencia mensual: ;;;;;;;;;x
EVTNAME20043;[Root.Liege.GetLordSpiritualName] 已被暴民所蹂躏;Notre [Root.Liege.GetLordSpiritualName] est pitin?par la foule.;[Root.Liege.GetLordSpiritualName] wurde vom Pbel niedergetrampelt;;[Root.Liege.GetLordSpiritualName] es pisoteado por la muchedumbre;;;;;;;;;x
EVTNAME20048;[Root.Liege.GetLordSpiritualName] 私吞善款;Notre [Root.Liege.GetLordSpiritualName] empoche les dons.;[Root.Liege.GetLordSpiritualName] streicht die Spendengelder ein;;[Root.Liege.GetLordSpiritualName] se queda con el dinero de la caridad;;;;;;;;;x
EVTNAME902;异教徒攻击[Root.Liege.GetLordSpiritualName];Les infidles attaquent notre [Root.Liege.GetLordSpiritualName];Heiden greifen den [Root.Liege.GetLordSpiritualName] an;;Los infieles atacan al [Root.Liege.GetLordSpiritualName];;;;;;;;;x
EVTOPTA8300;上帝所愿!;Deus Vult!;Deus Vult!;;Deus Vult!;;;;;;;;;x
EVTOPTA8301;赞美真主!;Ma chaAllah?;Masha'Allah!;;Masha'Allah!;;;;;;;;;x
EVTDESC8300;我们的军队正蓄势待发为了 [Root.Location.Kingdom.GetFullBaseName] 而参加 [Root.Religion.GetCrusadeName] .;Nos armes, assures de la victoire, sont prtes ?prendre part ?la [Root.Religion.GetCrusadeName] pour [Root.Location.Kingdom.GetFullBaseName]'.;Unsere Armeen stehen bereit, um sich am [Root.Religion.GetCrusadeName] vom [Root.Location.Kingdom.GetFullBaseName] zu beteiligen.;;Nuestros ejercitos se encuentran preparados para formar parte en la [Root.Religion.GetCrusadeName] por [Root.Location.Kingdom.GetFullBaseName].;;;;;;;;;x
;#ca_culture_west_african_1;Small Free Warrior Lodge;;kleine Kriegerhütte;;Campamento peque?o para los Guerreros;;;;;;;;;x;
;#ca_culture_west_african_2;Free Warrior Lodge;;Kriegerhütte;;Campamento para los Guerreros;;;;;;;;;x;
;#ca_culture_west_african_3;Large Free Warrior Lodge;;gro?e Kriegerhütte;;Campamento grande para los Guerreros;;;;;;;;;x;
;#ca_culture_west_african_4;Great Free Warrior Lodge;;riesige Kriegerhütte;;Campamento enorme para los Guerreros;;;;;;;;;x;
ca_culture_west_african_1;小型兵营;Hutte de guerriers libres;Kriegerhtte;;Campamento para los Guerreros;;;;;;;;;x
ca_culture_west_african_2;兵营;Hutte de guerriers libres;Kriegerhtte;;Campamento para los Guerreros;;;;;;;;;x
ca_culture_west_african_3;大型兵营;Hutte de guerriers libres;Kriegerhtte;;Campamento para los Guerreros;;;;;;;;;x
ca_culture_west_african_4;巨型兵营;Hutte de guerriers libres;Kriegerhtte;;Campamento para los Guerreros;;;;;;;;;x
CB_NAME_INVASION;入侵 [Title.GetBaseName];Invasion de [Title.GetBaseName];Invasion von [Title.GetBaseName];;Invasin de [Title.GetBaseName];;;;;;;;;x
WAR_NAME_INVASION;$ORDER$$FIRST_ADJ$ 入侵 $OTHER_TITLE$;$ORDER$Invasion $FIRST_ADJ$ de $OTHER_TITLE$;$ORDER$$FIRST_ADJ$ Invasion von $OTHER_TITLE$;;Invasin de $OTHER_TITLE$;;;;;;;;;x
WAR_NAME_DEC_INVASION;$FIRST_ADJ$ 入侵 $SECOND$;Invasion $FIRST_ADJ$ de $SECOND$;$FIRST_ADJ$ Invasion von $SECOND$;;Invasin $FIRST_ADJ$ de $SECOND$;;;;;;;;;x
GAIN_SETTLEMENT_UNDER_TITLE_EFFECT;占有 $REGION$ 境内 $GIVER$ 所拥有的领土;Obtenir toutes les proprits possdes par $GIVER$ en $REGION$;Erhalte alle Besitztmer von $GIVER$ in $REGION$;;Gana todas las posesiones de $GIVER$ en $REGION$;;;;;;;;;x
VASSALIZE_OR_TAKE_UNDER_TITLE_EFFECT;附庸或者占有 $REGION$ 境内 $GIVER$ 所拥有的领土;Vassaliser ou prendre toutes les possessions de $GIVER$ en $REGION$;Vasallisiere oder erhalte alle Besitztmer von $GIVER$ in $REGION$;;Haz vasallas o toma todas las posesiones de $GIVER$ en $REGION$;;;;;;;;;x
OFFER_PEACE_INTERACTION_DEMAND;这些是你的投降条款:;Voici les termes de votre reddition? ;Dies sind die Bedingungen fr eure Kapitulation;;Estas son las condiciones de tu rendicin:;;;;;;;;;x
OFFER_PEACE_INTERACTION_WHITE;在这些前提下，我们提出无条件和平:;Nous proposons une paix blanche selon ces termes? ;Wir schlagen einen Weien Frieden unter diesen Bedingungen vor:;;Proponemos una paz blanca bajo estas condiciones:;;;;;;;;;x
OFFER_PEACE_INTERACTION_SURRENDER;根据这些条款，我们投降:;Nous offrons notre reddition selon ces termes? ;Wir kapitulieren unter diesen Bedingungen:;;Nos redimos bajo estas condiciones:;;;;;;;;;x
DYNA_FILTER;筛选;Filtre;Filter;;Filtrar;;;;;;;;;x
DYNA_F_ALL;所有;Tous;Alle;;Todos;;;;;;;;;x
DYNA_F_ONLYMEN;只有男性;Hommes;Nur Mnner;;Slo hombres;;;;;;;;;x
DYNA_F_ONLYMEN_TT;排除所有无子女的女性;Afficher ou masquer les femmes sans enfant;Filtert alle kinderlosen Frauen heraus;;Descartar a todas las mujeres sin hijos;;;;;;;;;x
DYNA_F_ONLYLANDED;有头衔;Terriens;nur Landtitel;;Slo gobernantes;;;;;;;;;x
DYNA_F_ONLYLANDED_TT;筛选所有有头衔且没有子女的人物;Afficher ou masquer les personnages sans terre ni enfant;Filtert alle landlosen Charaktere ohne Kinder heraus;;Descartar a todos los personajes no gobernantes y sin hijos;;;;;;;;;x
DYNA_F_ONLYALIVE;只有在世的;En vie;Nur Lebende;;Slo vivos;;;;;;;;;x
DYNA_F_ONLYALIVE_TT;排除所有无子女的已死亡的角色;Afficher ou masquer les personnages morts sans enfant;Filtert alle toten Charaktere ohne Kinder heraus;;Descartar a todos los personajes muertos y sin hijos;;;;;;;;;x
invasion_succ_tip;Y[Root.GetTitledFirstName]?接管了所有占领的领土.\nY[Root.GetTitledFirstName]?成为了新的Y[This.GetRulerTitle]于[This.GetBaseName]?.\n; -Y[Root.GetTitledFirstName]? obtient tous les territoires occups.\nY[Root.GetTitledFirstName]? devient le nouveau Y[This.GetRulerTitle] de [This.GetBaseName]?.\n;Y[Root.GetTitledFirstName]? erhlt alle besetzten Gebiete. \nY[Root.GetTitledFirstName]? wird der neue Y[This.GetRulerTitle] von [This.GetBaseName]?.\n;;Y[Root.GetTitledFirstName]? toma todos los territorios ocupados. \nY[Root.GetTitledFirstName]? se convierte en el nuevo Y[This.GetRulerTitle] de [This.GetBaseName]?.\n;;;;;;;;;x
;#tribal_invasion_succ_tip;Y[Root.GetTitledFirstName]? takes all occupied territory.\nY[Root.GetTitledFirstName]? takes or vassalizes all titles in the Y[This.GetFullBaseName]?.\n;;Y[Root.GetTitledFirstName]? erh?lt alle besetzten Gebiete.\nY[Root.GetTitledFirstName]? erh?lt oder vasallisiert alle Titlel in Y[This.GetFullBaseName]?.\n;;Y[Root.GetTitledFirstName]? toma todos los territorios ocupados.\nY[Root.GetTitledFirstName]? toma o hace vasallos todos los títulos de Y[This.GetFullBaseName]?.\n;;;;;;;;;x;
PART_SCALED_PRESTIGE_EFFECT;从战争中获得Y$WHO$?: $DIRECTION$ $VALUE$ 威望.\n;Y$WHO$?? $DIRECTION$ $VALUE$ points de prestige pour la contribution ?l'effort de guerre.\n;Y$WHO$?: $DIRECTION$ $VALUE$ Prestige durch Kriegsbeitrag\n;;Y$WHO$?: $DIRECTION$ $VALUE$ Prestigio por su contribucin blica. \n;;;;;;;;;x
PART_SCALED_PIETY_EFFECT;从战争中获得Y$WHO$?: $DIRECTION$ $VALUE$ $PIETYNAME$.\n;Y$WHO$?: $DIRECTION$ $VALUE$ en $PIETYNAME$ pour la contribution ?l'effort de guerre.\n;Y$WHO$?: $DIRECTION$ $VALUE$ $PIETYNAME$ durch Kriegsbeitrag\n;;Y$WHO$?: $DIRECTION$ $VALUE$ $PIETYNAME$ por su contribucin blica. \n;;;;;;;;;x
NUM_OF_REALM_COUNTIES_LESS;Y$TITLE$?所控制的国家少于 Y$NUM$? ;Moins de Y$NUM$? comts contrls par Y$TITLE$?;Hlt weniger als Y$NUM$? Grafschaften innerhalb von Y$TITLE$?;;Menos de Y$NUM$? condados dominados por Y$TITLE$?;;;;;;;;;x
NUM_OF_REALM_COUNTIES_AT_LEAST;Y$TITLE$?最少控制 Y$NUM$?个国家;Au moins Y$NUM$? comts contrls par Y$TITLE$?;Hlt mindestens Y$NUM$? Grafschaften innerhalb von Y$TITLE$?;;Al menos Y$NUM$? condados dominados por Y$TITLE$?;;;;;;;;;x
SwordOfIslamDLC;伊斯兰之剑;L'pe de l'Islam;Das Schwert des Islam;;Espada del Islam;;;;;;;;;x
AfricanUnitPackDLC;非洲单位包;Pack d'units africaines;Afrikanische Einheiten Pack;;Pack de Unidades Africanas;;;;;;;;;x
SongsOfTheCaliphDLC;哈里发之歌;Les Chants du Calife;Lieder des Kalifen;;Canciones del Califa;;;;;;;;;x
opinion_subjugated;征服;Assujettissement;Unterworfen;;Subyugado;;;;;;;;;x
opinion_imprisoned_child;囚禁我的孩子;A emprisonn?mon enfant ;Hat mein Kind eingekerkert;;Encarcel?a mi hijo;;;;;;;;;x
opinion_executed_child;处决我的孩子;A excut?mon enfant ;Hat mein Kind hingerichtet;;Ejecut?a mi hijo;;;;;;;;;x
INTERACTION_CANNOT_GRANT_TO_PRISONERS;Y[Recipient.GetTitledFirstName]? 不能被囚禁;Y[Recipient.GetTitledFirstName]? ne doit pas tre en prison;Y[Recipient.GetTitledFirstName]? kann nicht eingekerkert sein;;Y[Recipient.GetTitledFirstName]? no debera estar encarcelado;;;;;;;;;x
IS_NOT_IN_REVOLT;没有发生暴动;Ne s'est pas rvolt?Ist NICHT in Revolte;;NO est?llevando a cabo una revuelta;;;;;;;;;x
IS_IN_REVOLT;正在发生暴动;Est en train de se rvolter;Ist in Revolte;;Est?llevando a cabo una revuelta;;;;;;;;;x
EVTDESC38220;[From.GetFirstName] 问“asks '我如何才能为 [Root.Religion.GetName] 的信仰服务”;[From.GetFirstName] demande Comment pourrais-je au mieux servir la foi [Root.Religion.GetName]?;Wie kann ich dem [Root.Religion.GetName]en Glauben am besten dienen?;;[From.GetFirstName] te pregunta 'Cmo puedo servir mejor a la fe [Root.Religion.GetName]?';;;;;;;;;x
EVTOPTA38220;勇敢的对抗对你的敌人!;Soit brave face ?nos ennemis?;Sei mutig gegenber unseren Feinden!;;Se valiente contra tus enemigos!;;;;;;;;;x
EVTOPTB38220;公正对待所有的孩子;Soit juste avec tous ses enfants;Sei gerecht zu ihren Kindern;;Se justo con todos sus hijos!;;;;;;;;;x
INHERIT_EFFECT_UNKNOWN;Y$ABDICATOR$? 退位了.\n;Y$ABDICATOR$? abdique.\n;Y$ABDICATOR$? dankt ab.\n;;Y$ABDICATOR$? abdica. \n;;;;;;;;;x
YEARLY_DEC_CHANGE;Y由今年其他因素引起的变化?:\n;YVariations dues ?d'autres circonstances cette anne? ?\n;YVernderung aufgrund anderer Faktoren in diesem Jahr:?\n;;YCambios debidos a otros factores durante este ao:?\n;;;;;;;;;x
EVENTS;事件;vnements;Ereignisse;;Eventos;;;;;;;;;x
TITLEGRANTS;授予头衔;Titres octroys;Titel Gewhrungen;;Concesin de Ttulos;;;;;;;;;x
INTERACTION_CANNOT_JOIN_OUSIDER_VS_LIEGE;无法加入外来者针对我们领主的战争;Ne peut pas rejoindre une attaque trangre contre notre seigneur lige;Kann keinem reichsfremden Angriff gegen unseren Lehnsherrn beitreten;;No podemos unirnos a un atacante extranjero contra nuestro seor;;;;;;;;;x
INTERACTION_REQUIRES_YOUNG_FEMALE;Y$FEMALE$? 太老了;Y$FEMALE$? est trop vielle;Y$FEMALE$? ist zu alt;;Y$FEMALE$? es demasiado vieja;;;;;;;;;x
EXECUTE_IMPRISONED_INTERACTION_6;由于我是一个穆斯林并且Y[Recipient.GetTitledFirstName]?属于我的王朝,只有[Recipient.GetPossPronoun] 父母可能会关心.;tant donn?que je suis musulman et que Y[Recipient.GetTitledFirstName]? est de ma dynastie, seuls ses parents pourraient s'en offenser.;Da ich Muslim bin und Y[Recipient.GetTitledFirstName]? meiner Dynastie angehrt werden sich nur [Recipient.GetPossPronoun] Eltern dafr interessieren.;;Como soy musulmn y Y[Recipient.GetTitledFirstName]? es de mi dinasta, slo le importar?a [Recipient.GetPossPronoun] padres;;;;;;;;;x
IMPRISON_INTERACTION_6;由于我是一个穆斯林并且Y[Recipient.GetTitledFirstName]?属于我的王朝,只有[Recipient.GetPossPronoun] 父母可能会关心.;tant donn?que je suis musulman et que Y[Recipient.GetTitledFirstName]? est de ma dynastie, seuls ses parents pourraient s'en offenser.;Da ich Muslim bin und Y[Recipient.GetTitledFirstName]? meiner Dynastie angehrt werden sich nur [Recipient.GetPossPronoun] Eltern dafr interessieren.;;Como soy musulmn y Y[Recipient.GetTitledFirstName]? es de mi dinasta, slo le importar?a [Recipient.GetPossPronoun] padres;;;;;;;;;x
DECADENT_RELATIVES;腐化的亲戚;Parents dcadents;Dekadente Verwandte;;Familiares Decadentes;;;;;;;;;x
DECADENCE_CHANGE;每月腐化度变化;Variation de dcadence mensuelle;Dekadenzanstieg pro Monat;;Cambio mensual de la decadencia;;;;;;;;;x
EVTDESC89030;你长久以来一直为你的丈夫 [Root.Spouse.GetTitledFirstName] 努力工作, 甚至为他生了一个儿子. 但是他其他没有你血脉的儿子谋取继承权, 并且有一天可能将你的儿子作为觊觎者杀死. 或许应该先下手为强...;Vous avez travaill?dur et longtemps pour votre mari,[Root.Spouse.GetTitledFirstName], et lui avez mme fait don d'un fils. Mais il a d'autres fils qui ne sont pas de votre sang qui un jour auront des vues sur le trne. Votre fils pourrait tre tu?en tant que prtendant. Peut-tre serait-il mieux de frapper la premire...  ;Sie haben sich lang und hart fr ihren Ehemann, [Root.Spouse.GetTitledFirstName], abgeplagt und ihm sogar einen Sohn geschenkt. Er hat jedoch noch andere Shne, die nicht ihren Lenden entsprungen sind und die eines Tages um den Thron kmpfen und ihren Sohn als Thronanwrter umbringen knnten. Vielleicht ist es besser, zuerst zuzuschlagen...;;Te has desvivido por tu marido, [Root.Spouse.GetTitledFirstName], incluso le has dado un hijo. Pero tiene hijos que no son tuyos que aspirarn al trono, y tu hijo puede ser asesinado por ser un pretendiente. Tal vez deberas dar el primer golpe...;;;;;;;;;x
EVTDESC89032;你的一位妻子, [From.GetFirstName], 被发现试图毒杀你的另一位妻子生的孩子. 所幸的是你的儿子在喝下茶之前察觉出来了. 她的目的似乎是提升她自己的孩子在你心中的地位...;L'une de vos femmes, [From.GetFirstName], a t?prise en train de servir une coupe de th?empoisonn??l'un de vos fils n?d'une autre femme. Seul les sens acrs de votre fils a rvl?que la boisson n'tait qu'un atroce poison avant qu'il ne trempe ses lvres dans la coupe. Il semble que le but de votre femme soit d'amliorer l'influence et la position de son propre fils ?votre gard... ;Einer eurer Frauen, [From.GetFirstName], wurde dabei erwischt, wie sie einem eurer Shne von einer anderen Frau eine Tasse vergifteten Tee servierte. Einzig den scharfen Sinnen eures Sohnes ist es zu verdanken, dass er das Getrnk als niedertrchtiges Gift erkannte, bevor er es trank. Es scheint, als wre es das Ziel euer Frau, den Einfluss und das Ansehen ihrer eigenen Nachkommen in euren Augen zu verbessern...;;Una de tus esposas, [From.GetFirstName], ha sido descubierta intentando servir un vaso de t?envenenado a un de tus hijos con otra de tus esposas. Slo los rapidos reflejos de tu hijo le hicieron darse cuenta del brebaje envenenado antes de beberlo. Parece que su motivacin era aumentar la influencia e importancia de su prole ante t?..;;;;;;;;;x
EVTDESC89034;你的一个儿子 在突然病倒之后神秘的死亡了. 虽然你和你的顾问们对此深表怀疑，但查不到任何有用的线索...;L'un de vos fils a mystrieusement pri aprs tre tomb?soudainement malade. Bien que vous et vos conseills suspectiez un jeu de dupe, vous n'avez aucune ide de qui blmer...;Einer eurer Shne ist unter mysterisen Umstnden verstorben, nachdem er ganz pltzlich erkrankt war. Obwohl sowohl ihr als auch eure Berater ein Verbrechen vermuten, habt ihr doch keine Ahnung, wer dafr verantwortlich sein knnte...;;Uno de tus hijos ha muerto en misteriosas circunstancias despus de enfermar repentinamente. Aunque tus consejeros y t?sospechais que se trataba de intrigas palaciegas, no tenais ni idea de a quien culpar por ello...;;;;;;;;;x
EVTDESC89035;你的一个儿子 在喝下你的奸诈的妻子 [From.GetFirstName]送来的毒茶之后突然暴毙了!它谋杀他的目的似乎是提升她自己额儿子在你心目中德地位.;Un de vos enfants est pass?de vie ?trpas aprs qu'[From.GetFirstName], votre tratresse de femme, lui ait servi une coupe de th?empoisonn? Il semblerait qu'elle l'aie assassin?afin d'amliorer l'influence et le statut de sa propre descendance auprs de vous;Einer eurer Shne ist verstorben, nachdem ihm von [From.GetFirstName], eurer verrterischen Frau, eine Tasse vergifteter Tee serviert worden war. Es scheint, als habe sie ihn ermordet, um den Einfluss und das Ansehen ihrer eigenen Nachkommen in euren Augen zu verbessern.;;Uno de tus hijos a fallecido despus de beber de una copa de t?envenenado que le sirvi?[From.GetFirstName], la traidora de tu esposa!. Parece que lo asesin?en un intento de aumentar la influencia e importancia de sus hijos ante t?;;;;;;;;;x
EVTTOOLTIP86166;分享面包.;Le pain est rompu.;Brot wird verteilt;;Compartamos el pan;;;;;;;;;x
EVTTOOLTIP86167;通知你不会加入他.;L'informer que vous n'allez pas vous joindre ?lui.;Informiert, dass ihr euch ihm nicht anschlieen werdet.;;Informale de que no te unirs a l;;;;;;;;;x
HEAD_OF_DYNASTY;王朝领袖;Chef de la dynastie;Dynastie-Oberhaupt;;Jefe de la Dinasta;;;;;;;;;x
