;#CODE;ENGLISH;FRENCH;GERMAN;;SPANISH;;;;;;;;;x;
EVTDESC91369;[From.GetBestName]未能在[From.GetPossPronoun]试图让腐败的[FromFrom.GetBestName]重新恢复过来.他是一名卡菲尔，可以随意的拘捕监禁我们腐败王朝的统治者！;[From.GetBestName] a chou?dans ses tentatives ?redresser la dcadence de [FromFrom.GetBestName]. C'est un kafir et peut tre emprisonn?librement par tout dirigeant de notre dynastie honteuse.;[From.GetBestName] hat nicht gelungen, den dekadenden [FromFrom.GetBestName] berzeugen um sich zu bessern. [FromFrom.GetBestName] ist einen Kafir und kann von allen Herrschern der Dynastie frei eingesperrt werden .;;[From.GetBestName] ha fallado en [From.GetPossPronoun] intento de convencer a [FromFrom.GetBestName] a enderezarse. Es un kafir y cualquier miembro de nuestra dinasta le puede imprisionar libremente.;;;;;;;;;x
EVTOPTA91369;将鞋子踩在他们的头上！;Une chaussure sur sa tte!;Ein Schuh auf seinem kopf!;;Un zapato sobre su cabeza!;;;;;;;;;x
EVTDESC91370;您的[GetFromRelation][From.GetBestName]已经成为腐败的源泉，并且已经是带来耻辱的[Root.GetOnlyDynastyName]的建筑！;Votre [GetFromRelation], [From.GetBestName], est devenu dcadent. Il fait honte ?la maison des [Root.GetOnlyDynastyName]!;Ihr [GetFromRelation], [From.GetBestName], ist dekadent geworden. Er bringt Schande ber das Haus [Root.GetOnlyDynastyName]!;;Tu [GetFromRelation], [From.GetBestName], es un decadente que da vergenza a la casa de [Root.GetOnlyDynastyName]!;;;;;;;;;x
EVTOPTA91370;忘恩负义！;Ingrat!;Undankbarer Mensch!;;Ingrato!;;;;;;;;;x
GRANT_LANDED_TITLE_INTERACTION_7;授予头衔给家族成员使家族腐化减少：G$DECADENCE$%?（效果与家族当前的腐化度相关）;Dcadence perdue due aux terres accordes aux membres de ma dynastie?  G$DECADENCE$%? (l'effet est relatif ?la dcadence actuelle de la dynastie);Dekadenzreduzierung durch Titelgewhrung an Dynastiemitglied: G$DECADENCE$%? (der Effekt ist relativ zum aktuellen Dekadenz der Dynastie);;Perdida de Decadencia por conceder un ttulo a un familiar: G$DECADENCE$%? (el efecto es relativo a la Decadencia actual de la dinasta);;;;;;;;;x
